{
  "schema_version": "1",
  "id": "binder-fixture-minimal",
  "title": "Minimal spine fixture",
  "items": [
    {
      "id": "item-1",
      "title": "Example task",
      "recordType": "task",
      "summary": "Fixture row",
      "markdown": "## Fixture\n\nValidates schema.",
      "status": "todo",
      "fields": { "lane": "test" }
    }
  ]
}
