{
  "schema_version": "1",
  "id": "binder-demo-unified",
  "title": "Northstar launch workspace",
  "items": [
    {
      "id": "doc-overview",
      "title": "Overview",
      "parentId": null,
      "docSlug": "overview",
      "summary": "Binder charter and outcomes",
      "markdown": "# Northstar launch\n\nThis **demo binder** is one object system: the same rows appear as tasks, docs, calendar blocks, social queue entries, and ops records.\n\nSwitch modes from the sidebar to see the mapping.",
      "status": "doing",
      "dueAt": "2026-04-10",
      "recordType": "doc",
      "fields": { "owner": "Core", "visibility": "team" }
    },
    {
      "id": "task-manifest",
      "title": "Ship manifest compile",
      "parentId": null,
      "docSlug": "manifest",
      "summary": "Compile + verify binder manifest",
      "markdown": "## Manifest\n\n- [ ] Validate paths\n- [ ] Sign bundle\n- [ ] Publish index",
      "status": "doing",
      "dueAt": "2026-04-05",
      "scheduledAt": "2026-04-05T14:00:00",
      "platforms": ["internal"],
      "campaignId": "launch-q2",
      "postState": "draft",
      "recordType": "task",
      "fields": { "estimate": "4h", "lane": "build" }
    },
    {
      "id": "task-surface",
      "title": "ThinUI workspace shell",
      "parentId": null,
      "summary": "Unified shell scaffold",
      "markdown": "## Shell\n\nSidebar, topbar, palette, drawer — one binder context.",
      "status": "todo",
      "dueAt": "2026-04-12",
      "scheduledAt": "2026-04-08T09:30:00",
      "recordType": "task",
      "fields": { "estimate": "8h", "lane": "ux" }
    },
    {
      "id": "post-teaser",
      "title": "Social teaser — countdown",
      "parentId": null,
      "summary": "Cross-post teaser",
      "markdown": "Launch week — stay tuned. #uDOS #ThinUI",
      "status": "doing",
      "dueAt": "2026-04-15",
      "scheduledAt": "2026-04-14T16:00:00",
      "platforms": ["mastodon", "bluesky", "linkedin"],
      "campaignId": "launch-q2",
      "postState": "scheduled",
      "recordType": "post",
      "fields": { "variant": "short", "utm": "launch-teaser" }
    },
    {
      "id": "ops-metrics",
      "title": "Dashboard — cadence",
      "parentId": null,
      "summary": "Ops card for publishing cadence",
      "markdown": "### Cadence\n\nTrack posts due, tasks due, and automation health in **Ops** mode.",
      "status": "done",
      "dueAt": "2026-04-01",
      "recordType": "metric",
      "fields": { "posts_due": "3", "tasks_due": "5", "automations": "idle" }
    },
    {
      "id": "doc-runbook",
      "title": "Runbook",
      "parentId": null,
      "docSlug": "runbook",
      "summary": "Operator runbook",
      "markdown": "# Runbook\n\n1. Open **Board** for status.\n2. Use **Calendar** for cutovers.\n3. **Social** for queue.\n4. **Ops** for field edits.",
      "status": "todo",
      "dueAt": "2026-04-20",
      "recordType": "doc",
      "fields": { "owner": "Ops", "visibility": "internal" }
    }
  ]
}
